name,rating,price,URL,transactions,location,cuisine,id,review counts,num_id,comments,processed_comments,processed_cuisine,processed_transactions,bogs
Dim Sum Palace,4,low,https://www.yelp.com/biz/dim-sum-palace-new-york-9?adjust_creative=YOPxpPg1qGggP5qGSctmew&utm_campaign=yelp_api_v3&utm_medium=api_v3_business_search&utm_source=YOPxpPg1qGggP5qGSctmew,"delivery, pickup", New York,Dim Sum,2wVirrAVg3ltAFHoHeXHMQ,359,147,"Decided to check this place out for weekend lunch; the line was long as expected but we got seated in 20-25 minutes. The servers were attentive, refilled our hot teas as often as they can. We ordered various dim sum plates, and beef Lo Mein, which were flavorful and filling. There are a lot of options nearby, but this is definitely one good options to consider when you are debating about which one to check out!",Decided check place weekend lunch line long expect get seat minute The server attentive refill hot tea often We order various dim sum plate beef Lo Mein flavorful fill There lot option nearby definitely one good option consider debate one check,Dim Sum,delivery pickup,Dim Sum Decided check place weekend lunch line long expect get seat minute The server attentive refill hot tea often We order various dim sum plate beef Lo Mein flavorful fill There lot option nearby definitely one good option consider debate one check delivery pickup
Aragvi,4,low,https://www.yelp.com/biz/aragvi-new-york?adjust_creative=YOPxpPg1qGggP5qGSctmew&utm_campaign=yelp_api_v3&utm_medium=api_v3_business_search&utm_source=YOPxpPg1qGggP5qGSctmew,"delivery, pickup", New York,Georgian,Lk3i0mZvzBBYts6BMOozDw,13,148,"Pretty solid Georgian food, but value might be better at Ubani. We tried Chefs Megruli with the smoked cheese and preferred the parts without the smoked cheese. I think the smoked cheese detracted from the dish, the original is better (and I am a lover of smoked cheese). We also had the lamb kebab mtsvadi which was well seasoned but also well done. I prefer my lamb more medium but maybe this is just the style? They didn't ask how we like the meat cooked. The honey cake was dry, not my favorite. I'm between a 3 and 4 on this review, I'd give them a weak 4. The host was very friendly and the wait staff was slow at refilling our waters but friendly as well. We came for an early dinner around 6ish, the restaurant really filled up by the time we left",Pretty solid Georgian food value might better Ubani We try Chefs Megruli smoked cheese prefer part without smoked cheese I think smoked cheese detract dish original better I lover smoked cheese We also lamb kebab mtsvadi well season also well I prefer lamb medium maybe style They ask like meat cook The honey cake dry favorite I review I give weak The host friendly wait staff slow refill water friendly well We come early dinner around restaurant really fill time leave,Georgian,delivery pickup,Georgian Pretty solid Georgian food value might better Ubani We try Chefs Megruli smoked cheese prefer part without smoked cheese I think smoked cheese detract dish original better I lover smoked cheese We also lamb kebab mtsvadi well season also well I prefer lamb medium maybe style They ask like meat cook The honey cake dry favorite I review I give weak The host friendly wait staff slow refill water friendly well We come early dinner around restaurant really fill time leave delivery pickup
NARO,5,pricey-dining,https://www.yelp.com/biz/naro-new-york?adjust_creative=YOPxpPg1qGggP5qGSctmew&utm_campaign=yelp_api_v3&utm_medium=api_v3_business_search&utm_source=YOPxpPg1qGggP5qGSctmew,, New York,Korean,OFc7aHP1chwqXTgtYtbJzQ,21,149,"Came here for our engagement anniversary dinner. NARO is a new Korean fine dining restaurant that has been around since October. It's on the rink level of the Rockefeller center and you can get here by stairs/ via an elevator located on 49th st. The staff is eager and knowledgeable, and we incorporated all our server's recommendations and weren't disappointed. We had the standard as well as the vegetarian chef's tatsting menu to get more variety. There's a beverage pairing option as well. The dishes were very innovative and well made. As expected for Korean food, the flavors are really subtle and delicate. Would recommend this place for a date night!",Came engagement anniversary dinner NARO new Korean fine din restaurant around since October It rink level Rockefeller center get via elevator locate st The staff eager knowledgeable incorporate server recommendation disappointed We standard well vegetarian chef tatsting menu get variety There beverage pair option well The dish innovative well made As expect Korean food flavor really subtle delicate Would recommend place date night,Korean,,Korean Came engagement anniversary dinner NARO new Korean fine din restaurant around since October It rink level Rockefeller center get via elevator locate st The staff eager knowledgeable incorporate server recommendation disappointed We standard well vegetarian chef tatsting menu get variety There beverage pair option well The dish innovative well made As expect Korean food flavor really subtle delicate Would recommend place date night 
Leroy's,4,low,https://www.yelp.com/biz/leroys-brooklyn?adjust_creative=YOPxpPg1qGggP5qGSctmew&utm_campaign=yelp_api_v3&utm_medium=api_v3_business_search&utm_source=YOPxpPg1qGggP5qGSctmew,, Brooklyn,Cocktail Bars,pnPSvAl60FDYiA46Sz2sWA,21,150,"Leroy's is our favorite neighborhood spot. Great place to grab a seat at the bar and enjoy cocktails, food, and elite vibes. My gf and I go at least once a week. The mussels and french fries are our go to's. High recommend coming to check this place out.",Leroy favorite neighborhood spot Great place grab seat bar enjoy cocktail food elite vibe My gf I go least week The mussel french fry go High recommend come check place,Cocktail Bars,,Cocktail Bars Leroy favorite neighborhood spot Great place grab seat bar enjoy cocktail food elite vibe My gf I go least week The mussel french fry go High recommend come check place 
Peter Luger,2,pricey-dining,https://www.yelp.com/biz/peter-luger-brooklyn-2?adjust_creative=YOPxpPg1qGggP5qGSctmew&utm_campaign=yelp_api_v3&utm_medium=api_v3_business_search&utm_source=YOPxpPg1qGggP5qGSctmew,, Brooklyn,Steakhouses,4yPqqJDJOQX69gC66YUDkA,6739,151,What can you say about a 130 year old restaurant. FABULOUS!  old school steak  house. Cocktails superb! Onion rings a bit greasy- I would skip next time for a different side. Sautéed broccoli was delicious. Steak was like butter. Chocolate mousse cake divine. Service perfect!!!!!  Reservations on the weekend needed.,What say year old restaurant FABULOUS old school steak house Cocktails superb Onion ring bit I would skip next time different side Sautéed broccoli delicious Steak like butter Chocolate mousse cake divine Service perfect Reservations weekend need,Steakhouses,,Steakhouses What say year old restaurant FABULOUS old school steak house Cocktails superb Onion ring bit I would skip next time different side Sautéed broccoli delicious Steak like butter Chocolate mousse cake divine Service perfect Reservations weekend need 
Dollar Hits - New York,5,popular-eats,https://www.yelp.com/biz/dollar-hits-new-york-new-york?adjust_creative=YOPxpPg1qGggP5qGSctmew&utm_campaign=yelp_api_v3&utm_medium=api_v3_business_search&utm_source=YOPxpPg1qGggP5qGSctmew,, New York,Filipino,_6ppndL8xhUBvylCur6fag,21,152,"What a great little spot! Everyone in there was kind and helpful to explain what options there were to eat.  You can choose to get food from the steam table (think rice entree dishes like chicken adobo etc) or go around the corner on the other side of the restaurant and pick out skewers.  I chose to focus on the skewers this time.  Plenty of choices.  They put your stuff in a basket and heat it on the grill in the kitchen.  I stayed in the restaurant to munch and ordered the cantaloupe juice.  The food took like 5-10 min for it to be reheated and they had a nice Smokey flavor to all the items. My fav was was the chicken feet and the pork  stick.   Sauces are self serve in the front, love the vinegar.  Everything was very affordable- it was 14 bucks for all my sticks  (1.50 each) and a refreshing drink (2 bucks) Will be back to try more items",What great little spot Everyone kind helpful explain option eat You choose get food steam table think rice entree dish like chicken adobo etc go around corner side restaurant pick skewer I choose focus skewer time Plenty choice They put stuff basket heat grill kitchen I stay restaurant munch order cantaloupe juice The food take like min reheat nice Smokey flavor item My fav chicken foot pork stick Sauces self serve front love vinegar Everything buck stick refreshing drink buck Will back try item,Filipino,,Filipino What great little spot Everyone kind helpful explain option eat You choose get food steam table think rice entree dish like chicken adobo etc go around corner side restaurant pick skewer I choose focus skewer time Plenty choice They put stuff basket heat grill kitchen I stay restaurant munch order cantaloupe juice The food take like min reheat nice Smokey flavor item My fav chicken foot pork stick Sauces self serve front love vinegar Everything buck stick refreshing drink buck Will back try item 
Arden,5,low,https://www.yelp.com/biz/arden-brooklyn?adjust_creative=YOPxpPg1qGggP5qGSctmew&utm_campaign=yelp_api_v3&utm_medium=api_v3_business_search&utm_source=YOPxpPg1qGggP5qGSctmew,"delivery, pickup", Brooklyn,American (New),RNRLQXg_P2cGxLEMVlKZQA,45,153,I came in with some friends randomly and loved the vibe of this place. Everyone was very nice and the food was great. I had the bone marrow to start (which was a special that night) and then had a GIANT! porkchop. The drinks were good too but next time I need to save room to try some dessert. Definitely coming back.,I come friend randomly love vibe place Everyone nice food great I bone marrow start special night GIANT porkchop The drink good next time I need save room try dessert Definitely come back,American New,delivery pickup,American New I come friend randomly love vibe place Everyone nice food great I bone marrow start special night GIANT porkchop The drink good next time I need save room try dessert Definitely come back delivery pickup
Paisley,2,low,https://www.yelp.com/biz/paisley-new-york-2?adjust_creative=YOPxpPg1qGggP5qGSctmew&utm_campaign=yelp_api_v3&utm_medium=api_v3_business_search&utm_source=YOPxpPg1qGggP5qGSctmew,"delivery, pickup", New York,Indian,fCxjrytrEw_l9vGjSCzszg,93,154,"Terrible service. Okay food. Not worth the price point at all. Brought a guest that was visiting from out of town thinking this would be better than other options in the neighborhood. Especially because we had been here before. Prices have increased dramatically (understandably) but the quality and quantity does not justify that. The main waiter had a terrible attitude. Didn't write the order down and forgot to give us our main appetizer. And then when the main food was already on the table, he came to confirm which item we were missing. And in addition, he was arguing about how the cheesecake dessert didn't have a completely frozen layer that was literally not edible. It was just too hard to bears into. Overall disastrous meal and will never come here again and certainly never bring a guest here again.",Terrible service Okay food Not worth price point Brought guest visit town thinking would better option neighborhood Especially Prices increase dramatically understandably quality quantity justify The main waiter terrible attitude Did write order forget give u main appetizer And main food already table come confirm item miss And addition argue cheesecake dessert completely frozen layer literally edible It hard bear Overall disastrous meal never come certainly never bring guest,Indian,delivery pickup,Indian Terrible service Okay food Not worth price point Brought guest visit town thinking would better option neighborhood Especially Prices increase dramatically understandably quality quantity justify The main waiter terrible attitude Did write order forget give u main appetizer And main food already table come confirm item miss And addition argue cheesecake dessert completely frozen layer literally edible It hard bear Overall disastrous meal never come certainly never bring guest delivery pickup
Mekelburg's,5,low,https://www.yelp.com/biz/mekelburgs-brooklyn-3?adjust_creative=YOPxpPg1qGggP5qGSctmew&utm_campaign=yelp_api_v3&utm_medium=api_v3_business_search&utm_source=YOPxpPg1qGggP5qGSctmew,"delivery, pickup", Brooklyn,Bars,-pcCiCeyK4cvLtnkcF9T5Q,109,155,"I came here for the chicken sandwich special on Thursday for $8..fine print u have to buy a cocktail..really wasn't expecting that, but no biggie. Ordered the sandwich with a margarita came out to $22. The sandwich was so delicious, it was kinda on the sweet side, wish it had more spicy..but never the less..I called myself trying to eat half and save the rest for later..I ate the whole thing ..the absolute perfect crunch..loved the flavor..sooooo goooood, I almost bit my finger. I'm looking forward going back Wednesday for trivia night..and karaoke..",I come chicken sandwich special Thursday fine print u buy cocktail really expect biggie Ordered sandwich margarita come The sandwich delicious kinda sweet side wish spicy never le I call try eat half save rest later I eat whole thing absolute perfect crunch love flavor sooooo goooood I almost bite finger I look forward go back Wednesday trivia night karaoke,Bars,delivery pickup,Bars I come chicken sandwich special Thursday fine print u buy cocktail really expect biggie Ordered sandwich margarita come The sandwich delicious kinda sweet side wish spicy never le I call try eat half save rest later I eat whole thing absolute perfect crunch love flavor sooooo goooood I almost bite finger I look forward go back Wednesday trivia night karaoke delivery pickup
12 Chairs Cafe,3,low,https://www.yelp.com/biz/12-chairs-cafe-new-york?adjust_creative=YOPxpPg1qGggP5qGSctmew&utm_campaign=yelp_api_v3&utm_medium=api_v3_business_search&utm_source=YOPxpPg1qGggP5qGSctmew,"delivery, pickup", New York,Middle Eastern,4lvM8_IWe_TgSszfwhmrdg,436,156,Every had Israeli food so this was my first experience. It was a great first experience!! The Borek dish was super yummy- the outer crisp and the potato seasoned inside with the sauce paired great! The service was not the best because they were so busy and the place was very small but that's given since it's on MacDougal st.,Every Israeli food first experience It great first experience The Borek dish super outer crisp potato season inside sauce pair great The service best busy place small give since MacDougal st,Middle Eastern,delivery pickup,Middle Eastern Every Israeli food first experience It great first experience The Borek dish super outer crisp potato season inside sauce pair great The service best busy place small give since MacDougal st delivery pickup
Xu's Public House,4,mid-range,https://www.yelp.com/biz/xus-public-house-new-york-2?adjust_creative=YOPxpPg1qGggP5qGSctmew&utm_campaign=yelp_api_v3&utm_medium=api_v3_business_search&utm_source=YOPxpPg1qGggP5qGSctmew,"delivery, pickup", New York,Chinese,VbFYau70iG_s6UNFwYtGVQ,140,157,"Xu's Public House offers some delicious dishes in a swanky setting!  I don't eat seafood so we stayed away from their extensive seafood selection. We loved everything we ordered. The snow white pork buns were exceptional. The outside is crisp but then instantly give way to a fluffy, slightly sweet dough and savory filling. We also ordered the sheng jian boa, but they were showed up by the snow white pork buns. The Shanghai soup dumplings were excellent. The dough was thick like I like it and the filling was hearty and delicious, especially dipped in the vinegar sauce. The beef chow fun was very tasty as were the sauteed pea shoots with garlic (these were even better than Han Dynasty's because they were less garlicy). The scallion pancakes and egg tarts were also good, but not as special as the other dishes. In addition to the yummy food, the service was very attentive.",Xu Public House offer delicious dish swanky setting I eat seafood stay away extensive seafood selection We love everything order The snow white pork bun exceptional The outside crisp instantly give way fluffy slightly sweet dough savory filling We also order sheng jian boa show snow white pork bun The Shanghai soup dumpling excellent The dough thick like I like filling hearty delicious especially dip vinegar sauce The beef chow fun tasty sauteed pea shoot garlic even better Han Dynasty le garlicy The scallion pancake egg tart also good special dish In addition yummy food service attentive,Chinese,delivery pickup,Chinese Xu Public House offer delicious dish swanky setting I eat seafood stay away extensive seafood selection We love everything order The snow white pork bun exceptional The outside crisp instantly give way fluffy slightly sweet dough savory filling We also order sheng jian boa show snow white pork bun The Shanghai soup dumpling excellent The dough thick like I like filling hearty delicious especially dip vinegar sauce The beef chow fun tasty sauteed pea shoot garlic even better Han Dynasty le garlicy The scallion pancake egg tart also good special dish In addition yummy food service attentive delivery pickup
GunBae Tribeca,4,low,https://www.yelp.com/biz/gunbae-tribeca-new-york?adjust_creative=YOPxpPg1qGggP5qGSctmew&utm_campaign=yelp_api_v3&utm_medium=api_v3_business_search&utm_source=YOPxpPg1qGggP5qGSctmew,"delivery, pickup, restaurant_reservation", New York,Korean,0GN6l4FAknTFSWZhEan45A,382,158,Came here with a large group and was throughly impressed with their ability to serve us all so efficiently. Robin was our main server and cooked most of our meat. She made the experience 5 stars instead of 4 because she was so personable. She even threw some kimchi on the grill for us which I've never had. It was even better off the grill! We got one of the combos and tried multiple cuts of meat. The food was good and the ambiance was fun for the group. My favorite side was the soup with beef and tofu--great flavors. Only downfall (in my opinion) is every inch of my clothing smelling like Korean BBQ after. Wish there was a way to leave not smelling like the food.,Came large group throughly impress ability serve u efficiently Robin main server cook meat She make experience star instead personable She even throw kimchi grill u I never It even better grill We get one combo tried multiple cut meat The food good ambiance fun group My favorite side soup beef tofu great flavor Only downfall opinion every inch clothing smell like Korean BBQ Wish way leave smell like food,Korean,delivery pickup,Korean Came large group throughly impress ability serve u efficiently Robin main server cook meat She make experience star instead personable She even throw kimchi grill u I never It even better grill We get one combo tried multiple cut meat The food good ambiance fun group My favorite side soup beef tofu great flavor Only downfall opinion every inch clothing smell like Korean BBQ Wish way leave smell like food delivery pickup
Jongro BBQ,4,low,https://www.yelp.com/biz/jongro-bbq-new-york-3?adjust_creative=YOPxpPg1qGggP5qGSctmew&utm_campaign=yelp_api_v3&utm_medium=api_v3_business_search&utm_source=YOPxpPg1qGggP5qGSctmew,delivery, New York,Korean,FZpm4_fbd6P984foOUejWg,2455,159,Group of 10 colleagues yesterday at 6:20p. Just 10 min wait and table was set up for us. Grateful the music was not as loud as the last time I was there and I could actually carry a convo at mild yelling. Wine was also added to the menu. Chardonnay was not bad. Missing all the complimentary niblings that I am used to. I think there was ONE served. The meats were very good. The seafood pancake was very soggy. The seafood glass noodle were also soggy. Good amount of green lettuce.,Group colleague yesterday Just min wait table set u Grateful music loud last time I I could actually carry convo mild yell Wine also add menu Chardonnay bad Missing complimentary niblings I use I think ONE serve The meat good The seafood pancake soggy The seafood glass noodle also soggy Good amount green lettuce,Korean,delivery,Korean Group colleague yesterday Just min wait table set u Grateful music loud last time I I could actually carry convo mild yell Wine also add menu Chardonnay bad Missing complimentary niblings I use I think ONE serve The meat good The seafood pancake soggy The seafood glass noodle also soggy Good amount green lettuce delivery
Keg & Lantern Brewing Company,5,low,https://www.yelp.com/biz/keg-and-lantern-brewing-company-brooklyn-2?adjust_creative=YOPxpPg1qGggP5qGSctmew&utm_campaign=yelp_api_v3&utm_medium=api_v3_business_search&utm_source=YOPxpPg1qGggP5qGSctmew,"delivery, pickup", Brooklyn,Pubs,V3xiyKV_xwmRMfNTMKzHvQ,1,160,Good wings even better beer. The servers were really friendly and attentive. Nice place to hang back with friends. Will be back,Good wing even better beer The server really friendly attentive Nice place hang back friend Will back,Pubs,delivery pickup,Pubs Good wing even better beer The server really friendly attentive Nice place hang back friend Will back delivery pickup
Bites of Xi'an,3,low,https://www.yelp.com/biz/bites-of-xian-new-york?adjust_creative=YOPxpPg1qGggP5qGSctmew&utm_campaign=yelp_api_v3&utm_medium=api_v3_business_search&utm_source=YOPxpPg1qGggP5qGSctmew,"delivery, pickup", New York,Burgers,--SoNTeCXFUx56no0OgibQ,80,161,"Amazing place, noodles are full of flavor and the perfect chewy texture. You get to choose between the regular hand pulled noodles or thick style. Plenty of seating, and it appears they take lots of take out orders as well. Prices are beyond reasonable for the portion you get, I was perfectly satisfied after finishing my bowl.",Amazing place noodle full flavor perfect chewy texture You get choose regular hand pull noodle thick style Plenty seating appear take lot take order well Prices beyond reasonable portion get I perfectly satisfy finish bowl,Burgers,delivery pickup,Burgers Amazing place noodle full flavor perfect chewy texture You get choose regular hand pull noodle thick style Plenty seating appear take lot take order well Prices beyond reasonable portion get I perfectly satisfy finish bowl delivery pickup
El Mate,5,low,https://www.yelp.com/biz/el-mate-brooklyn?adjust_creative=YOPxpPg1qGggP5qGSctmew&utm_campaign=yelp_api_v3&utm_medium=api_v3_business_search&utm_source=YOPxpPg1qGggP5qGSctmew,"pickup, delivery", Brooklyn,Argentine,L0XYugkXpuACPMQ451MB8g,352,162,"This place is amazing!! Thank you Diego and Gustavo! Recommendations were not only on point but they were excellent! I went before With my brother for the morcilla (blood sausage) and yucca purée but this time, Diego suggested the potato salad. It was good excellent and a great pair. Highly recommend!!!!! pS, they will be activating their space for entertainment in the spring and summer, so please follow!!",This place amazing Thank Diego Gustavo Recommendations point excellent I go With brother morcilla blood sausage yucca purée time Diego suggest potato salad It good excellent great pair Highly recommend pS activate space entertainment spring summer please follow,Argentine,pickup delivery,Argentine This place amazing Thank Diego Gustavo Recommendations point excellent I go With brother morcilla blood sausage yucca purée time Diego suggest potato salad It good excellent great pair Highly recommend pS activate space entertainment spring summer please follow pickup delivery
Dinner Party,5,low,https://www.yelp.com/biz/dinner-party-brooklyn?adjust_creative=YOPxpPg1qGggP5qGSctmew&utm_campaign=yelp_api_v3&utm_medium=api_v3_business_search&utm_source=YOPxpPg1qGggP5qGSctmew,, Brooklyn,American (New),yGFQFm3O9vCsKTVpvmDuGg,26,163,A gem of a spot. I'm glad I got to go for lunch before it inevitably becomes the next hardest spot to get a reservation. I visited for lunch and was greeted by the loveliest and most eclectic of atmospheres. I love that every week the menu changes and that their ingredients are fresh! I thoroughly enjoyed everything  on their lunch menu. The value for what you get is amazing! Definitely will be back for dinner,A gem spot I glad I get go lunch inevitably become next hardest spot get reservation I visit lunch greet loveliest eclectic atmosphere I love every week menu change ingredient fresh I thoroughly enjoy everything lunch menu The value get amazing Definitely back dinner,American New,,American New A gem spot I glad I get go lunch inevitably become next hardest spot get reservation I visit lunch greet loveliest eclectic atmosphere I love every week menu change ingredient fresh I thoroughly enjoy everything lunch menu The value get amazing Definitely back dinner 
City Vineyard,5,mid-range,https://www.yelp.com/biz/city-vineyard-new-york-2?adjust_creative=YOPxpPg1qGggP5qGSctmew&utm_campaign=yelp_api_v3&utm_medium=api_v3_business_search&utm_source=YOPxpPg1qGggP5qGSctmew,"delivery, pickup", New York,Wine Bars,ooYUO3Pq_qypc1NXFzeLYQ,1137,164,Most affordable option for outdoor bubble dining we've ever seen! You can reserve a dome without any extra charge and it's a beautiful view. Went in freezing weather and was kept toasty. Food was good and server was polite.,Most affordable option outdoor bubble din ever see You reserve dome without extra charge beautiful view Went freeze weather keep toasty Food good server polite,Wine Bars,delivery pickup,Wine Bars Most affordable option outdoor bubble din ever see You reserve dome without extra charge beautiful view Went freeze weather keep toasty Food good server polite delivery pickup
