name,rating,price,URL,transactions,location,cuisine,id,review counts,num_id,comments,processed_comments,processed_cuisine,processed_transactions,bogs
Marian's,3,low,https://www.yelp.com/biz/marians-new-york?adjust_creative=YOPxpPg1qGggP5qGSctmew&utm_campaign=yelp_api_v3&utm_medium=api_v3_business_search&utm_source=YOPxpPg1qGggP5qGSctmew,, New York,American (New),dbxrlDoBwR6br4htUy8YpA,46,207,"This review is for brunch only. If you're looking for a reliable spot that hits all the menu classics (some with a twist) in the WV, this is it. Service is solid, ambience is a combo of old school yet chic, and the food is good. Nothing is over the top or really WOW, but it satisfies the Sunday brunch moment. Could come here every weekend and feel good about it.",This review brunch If look reliable spot hit menu classic twist WV Service solid ambience combo old school yet chic food good Nothing top really WOW satisfy Sunday brunch moment Could come every weekend feel good,American New,,American New This review brunch If look reliable spot hit menu classic twist WV Service solid ambience combo old school yet chic food good Nothing top really WOW satisfy Sunday brunch moment Could come every weekend feel good 
Bar Camillo,5,low,https://www.yelp.com/biz/bar-camillo-brooklyn?adjust_creative=YOPxpPg1qGggP5qGSctmew&utm_campaign=yelp_api_v3&utm_medium=api_v3_business_search&utm_source=YOPxpPg1qGggP5qGSctmew,"pickup, delivery", Brooklyn,Italian,I6v7Tmb6kHS4P3ioT_xEhA,47,208,"I've only been for drinks. I love the Bedstuy area, so it lends to the ambience of the bar. The bartender was very knowledgeable,and allowed me to sample a few spirits. The cocktails were all sensational. I'll need to come back to try the pizza, which came highly recommended.",I drink I love Bedstuy area lend ambience bar The bartender knowledgeable allow sample spirit The cocktail sensational I need come back try pizza come highly recommend,Italian,pickup delivery,Italian I drink I love Bedstuy area lend ambience bar The bartender knowledgeable allow sample spirit The cocktail sensational I need come back try pizza come highly recommend pickup delivery
Jacob's Pickles,4,low,https://www.yelp.com/biz/jacobs-pickles-new-york?adjust_creative=YOPxpPg1qGggP5qGSctmew&utm_campaign=yelp_api_v3&utm_medium=api_v3_business_search&utm_source=YOPxpPg1qGggP5qGSctmew,"pickup, delivery", New York,Comfort Food,xt4sa64WOrpJvZBDPNPNYg,5216,209,"De-lish-ious! Everything about this place was great! The loud music puts you in the right vibe for a boozy brunch, however my friend and I didn't drink, and we still fit right in. The poutine was beyond any poutine I've had stateside, and our waiter was great! The kitchen was actually having a small issue and they comped the poutine. Oh and how can I forget the breakfast biscuit. I left being a biscuit fan. It was the perfect texture with the right amount of sweet; kind of like a cornbread. Amazing amazing food and experience here!",Everything place great The loud music put right vibe boozy brunch however friend I drink still fit right The poutine beyond poutine I stateside waiter great The kitchen actually small issue comped poutine Oh I forget breakfast biscuit I leave biscuit fan It perfect texture right amount sweet kind like cornbread Amazing amazing food experience,Comfort Food,pickup delivery,Comfort Food Everything place great The loud music put right vibe boozy brunch however friend I drink still fit right The poutine beyond poutine I stateside waiter great The kitchen actually small issue comped poutine Oh I forget breakfast biscuit I leave biscuit fan It perfect texture right amount sweet kind like cornbread Amazing amazing food experience pickup delivery
Yia Yia's Taverna,4,low,https://www.yelp.com/biz/yia-yias-taverna-brooklyn-4?adjust_creative=YOPxpPg1qGggP5qGSctmew&utm_campaign=yelp_api_v3&utm_medium=api_v3_business_search&utm_source=YOPxpPg1qGggP5qGSctmew,"pickup, delivery", Brooklyn,Greek,Vw8NSOu7aS8de1vVhFpemQ,318,210,"Good portion size for a reasonable price. Restaurant is nice and spacious, with modern interior design. Tried both the lamb and chicken gyro, which were beautifully seasoned and flavorful and very filling. The tzatziki was fresh and very flavorful as well, which complemented the meat. Definitely beats any gyro food carts that I have tried.",Good portion size reasonable price Restaurant nice spacious modern interior design Tried lamb chicken gyro beautifully season flavorful filling The tzatziki fresh flavorful well complement meat Definitely beat gyro food cart I try,Greek,pickup delivery,Greek Good portion size reasonable price Restaurant nice spacious modern interior design Tried lamb chicken gyro beautifully season flavorful filling The tzatziki fresh flavorful well complement meat Definitely beat gyro food cart I try pickup delivery
Bobwhite Counter,5,popular-eats,https://www.yelp.com/biz/bobwhite-counter-new-york-7?adjust_creative=YOPxpPg1qGggP5qGSctmew&utm_campaign=yelp_api_v3&utm_medium=api_v3_business_search&utm_source=YOPxpPg1qGggP5qGSctmew,"pickup, delivery", New York,Southern,nD7Hcq5aaCASbWzc0-Sg3A,891,211,"I found this place by mistake. I was working in the area and smelled chicken after doing a quick search of the area found it. The server was courteous & helpful.  Now to the best part the chicken was juicy,tender & flavorful. I purchased the 10 piece mixed which has 5 drums & 5 thighs. The next day reheated in the air fryer and it was as still juicy. I love this chicken. They have a variety of sides that I'll be trying as well.",I find place mistake I work area smell chicken quick search area find The server courteous helpful Now best part chicken juicy tender flavorful I purchase piece mixed drum thigh The next day reheat air fryer still juicy I love chicken They variety side I try well,Southern,pickup delivery,Southern I find place mistake I work area smell chicken quick search area find The server courteous helpful Now best part chicken juicy tender flavorful I purchase piece mixed drum thigh The next day reheat air fryer still juicy I love chicken They variety side I try well pickup delivery
Counter & Bodega,4,low,https://www.yelp.com/biz/counter-and-bodega-new-york?adjust_creative=YOPxpPg1qGggP5qGSctmew&utm_campaign=yelp_api_v3&utm_medium=api_v3_business_search&utm_source=YOPxpPg1qGggP5qGSctmew,"pickup, delivery", New York,Latin American,ddFY9PpygYagv7-jVduB2Q,247,212,"I was in the area looking for a casual lunch spot when I came across Counter & Bodega. They have lunch specials every day (including weekend), so I stopped in for the pernil lunch plate with sweet plantains, yellow rice, and chicharron with a mango juice/soda to drink. Everything was excellent from the service to the food. The chicharron was deliciously crunchy with a little bit of fat still on it and the pernil was excellently tender. I can't wait to come back to try the mofongo!",I area look casual lunch spot I come across Counter Bodega They lunch special every day include weekend I stop pernil lunch plate sweet plantain yellow rice chicharron mango drink Everything excellent service food The chicharron deliciously crunchy little bit fat still pernil excellently tender I ca wait come back try mofongo,Latin American,pickup delivery,Latin American I area look casual lunch spot I come across Counter Bodega They lunch special every day include weekend I stop pernil lunch plate sweet plantain yellow rice chicharron mango drink Everything excellent service food The chicharron deliciously crunchy little bit fat still pernil excellently tender I ca wait come back try mofongo pickup delivery
Peaches HotHouse,5,low,https://www.yelp.com/biz/peaches-hothouse-brooklyn?adjust_creative=YOPxpPg1qGggP5qGSctmew&utm_campaign=yelp_api_v3&utm_medium=api_v3_business_search&utm_source=YOPxpPg1qGggP5qGSctmew,"pickup, delivery", Brooklyn,Southern,GA5msU6NO9rQRctPfDJCBg,1409,213,"Impromptu pop in while in Brooklyn on a Monday afternoon, walked in with a semi large group not realizing the space is on the smaller side but staff were really accommodating. A couple of tables were placed together and we were set. Space was clean, staff were friendly, and food was delish! Faves: Grand Mimosa, fried chicken, cornbread, Mac n cheese. Ash was very attentive, really took care of our group and we appreciated his service to a T. 100% recommend! Thank you for your service :)",Impromptu pop Brooklyn Monday afternoon walk semi large group realize space smaller side staff really accommodate A couple table place together set Space clean staff friendly food delish Faves Grand Mimosa fry chicken cornbread Mac n cheese Ash attentive really take care group appreciate service recommend Thank service,Southern,pickup delivery,Southern Impromptu pop Brooklyn Monday afternoon walk semi large group realize space smaller side staff really accommodate A couple table place together set Space clean staff friendly food delish Faves Grand Mimosa fry chicken cornbread Mac n cheese Ash attentive really take care group appreciate service recommend Thank service pickup delivery
Lupa,4,mid-range,https://www.yelp.com/biz/lupa-new-york?adjust_creative=YOPxpPg1qGggP5qGSctmew&utm_campaign=yelp_api_v3&utm_medium=api_v3_business_search&utm_source=YOPxpPg1qGggP5qGSctmew,"pickup, delivery", New York,Italian,yZJbealagfujEkgesAl2hA,1723,214,"It's been quite sometime since I've been here, but it was good as I had always remembered! What a fantastic spot with delicious pastas and a cream of the crop wine list. OH! And those brussels sprouts are absolutely fantastic! Seriously, some of the best I've ever had! Marco our server was excellent and make the evening enjoyable. I love when a NYC fav becomes a NYC classic. So perfect!",It quite sometime since I good I always remember What fantastic spot delicious pasta cream crop wine list OH And brussels sprout absolutely fantastic Seriously best I ever Marco server excellent make evening enjoyable I love NYC fav become NYC classic So perfect,Italian,pickup delivery,Italian It quite sometime since I good I always remember What fantastic spot delicious pasta cream crop wine list OH And brussels sprout absolutely fantastic Seriously best I ever Marco server excellent make evening enjoyable I love NYC fav become NYC classic So perfect pickup delivery
Maman,5,low,https://www.yelp.com/biz/maman-new-york-22?adjust_creative=YOPxpPg1qGggP5qGSctmew&utm_campaign=yelp_api_v3&utm_medium=api_v3_business_search&utm_source=YOPxpPg1qGggP5qGSctmew,"pickup, delivery", New York,Cafes,DE0ROwygh-86i4s-WLp8wQ,736,215,Mike and Rebecca are so nice - awesome service! And the cookies are the best in town.,Mike Rebecca nice awesome service And cooky best town,Cafes,pickup delivery,Cafes Mike Rebecca nice awesome service And cooky best town pickup delivery
Izakaya,4,low,https://www.yelp.com/biz/izakaya-new-york-2?adjust_creative=YOPxpPg1qGggP5qGSctmew&utm_campaign=yelp_api_v3&utm_medium=api_v3_business_search&utm_source=YOPxpPg1qGggP5qGSctmew,"pickup, delivery", New York,Izakaya,i8F0fnempD5fTb2CxbwKDw,277,216,"Really solid japanese tapas spot with delicious small plates and a cool intimate vibe. Loved the agedashi tofu, chicken nanban, salmon sashimi, and addictive cabbage! Will definitely be back since there was more on the menu I would try.",Really solid japanese tapa spot delicious small plate cool intimate vibe Loved agedashi tofu chicken nanban salmon sashimi addictive cabbage Will definitely back since menu I would try,Izakaya,pickup delivery,Izakaya Really solid japanese tapa spot delicious small plate cool intimate vibe Loved agedashi tofu chicken nanban salmon sashimi addictive cabbage Will definitely back since menu I would try pickup delivery
Maru 2,5,popular-eats,https://www.yelp.com/biz/maru-2-new-york-4?adjust_creative=YOPxpPg1qGggP5qGSctmew&utm_campaign=yelp_api_v3&utm_medium=api_v3_business_search&utm_source=YOPxpPg1qGggP5qGSctmew,"pickup, delivery", New York,Japanese,WlRZ4JEAVqtemQ5WQhFAFg,160,217,"The price is right here The perfect hole in the wall, small, local business place to grab food on the go. It's perfect for a quick lunch during work days  , especially if you're trying to eat healthy, fresh food without breaking the bank. It's Korean Japanese fusion, so I would say their yummy sticks / sushi burritos are a combination of kimbap and sushi - in the form of a burrito of course. I need to try the other items on their menu, such as the udon, next! Sometimes there is a small line but the service is really quick and always friendly. I'm so glad I found this place.",The price right The perfect hole wall small local business place grab food go It perfect quick lunch work day especially try eat healthy fresh food without break bank It Korean Japanese fusion I would say yummy stick sushi burrito combination kimbap sushi form burrito course I need try item menu udon next Sometimes small line service really quick always friendly I glad I find place,Japanese,pickup delivery,Japanese The price right The perfect hole wall small local business place grab food go It perfect quick lunch work day especially try eat healthy fresh food without break bank It Korean Japanese fusion I would say yummy stick sushi burrito combination kimbap sushi form burrito course I need try item menu udon next Sometimes small line service really quick always friendly I glad I find place pickup delivery
Medusa The Greek,5,low,https://www.yelp.com/biz/medusa-the-greek-brooklyn?adjust_creative=YOPxpPg1qGggP5qGSctmew&utm_campaign=yelp_api_v3&utm_medium=api_v3_business_search&utm_source=YOPxpPg1qGggP5qGSctmew,"pickup, delivery", Brooklyn,Greek,h77VtGL7BCXvAALx-ZFbVA,204,218,"The food is really good. The portion is on the smaller side. Excellent service! Cute ambiance,  good for brunch, lunch, or dinner.",The food really good The portion smaller side Excellent service Cute ambiance good brunch lunch dinner,Greek,pickup delivery,Greek The food really good The portion smaller side Excellent service Cute ambiance good brunch lunch dinner pickup delivery
Chinah,4,low,https://www.yelp.com/biz/chinah-brooklyn?adjust_creative=YOPxpPg1qGggP5qGSctmew&utm_campaign=yelp_api_v3&utm_medium=api_v3_business_search&utm_source=YOPxpPg1qGggP5qGSctmew,"pickup, delivery", Brooklyn,Chinese,j61hBldPvd47MdLgeySlxQ,9,219,"The people working there are professional and kind.  The food has a lot of options and the quality is very good.  A great spot for lunch i highly recommend it, a lot of mix and match options. The outside doesn't make it look like a food spot looks more like a boutique,  but I will definitely be visiting again.",The people work professional kind The food lot option quality good A great spot lunch highly recommend lot mix match option The outside make look like food spot look like boutique I definitely visit,Chinese,pickup delivery,Chinese The people work professional kind The food lot option quality good A great spot lunch highly recommend lot mix match option The outside make look like food spot look like boutique I definitely visit pickup delivery
no. 7,3,low,https://www.yelp.com/biz/no-7-brooklyn-3?adjust_creative=YOPxpPg1qGggP5qGSctmew&utm_campaign=yelp_api_v3&utm_medium=api_v3_business_search&utm_source=YOPxpPg1qGggP5qGSctmew,, Brooklyn,American (New),nnMEtKLL0lyaXyXACRkVEQ,8,220,"Popped in to the new no 7 on a weeknight this week and overall had a good meal, though I now know exactly what I'd do if I came back. While the cocktail list and cocktails themselves were fine, I'd grab your beer of choice or a classic cocktail and snag a seat at the bar. From there, I'd order the broccoli tacos (they pack a ton of flavor on their own but the add a few dashes of the sauce they'll bring out and it's a flavor explosion) and also a side of fries (as long as you like em McDonalds style). That's it - that's the order. If you absolutely must have a larger meal, I think the fried chicken sandwich was quite tasty. Tried the cheeseburger too but it was very minimalistic and frankly, very rare - didn't taste like much else than... meat. *shrugs*",Popped new weeknight week overall good meal though I know exactly I I come back While cocktail list cocktail fine I grab beer choice classic cocktail snag seat bar From I order broccoli taco pack ton flavor add dash sauce bring flavor explosion also side fry long like em McDonalds style That order If absolutely must larger meal I think fried chicken sandwich quite tasty Tried cheeseburger minimalistic frankly rare taste like much else meat shrug,American New,,American New Popped new weeknight week overall good meal though I know exactly I I come back While cocktail list cocktail fine I grab beer choice classic cocktail snag seat bar From I order broccoli taco pack ton flavor add dash sauce bring flavor explosion also side fry long like em McDonalds style That order If absolutely must larger meal I think fried chicken sandwich quite tasty Tried cheeseburger minimalistic frankly rare taste like much else meat shrug 
Butter Dose,4,low,https://www.yelp.com/biz/butter-dose-new-york-2?adjust_creative=YOPxpPg1qGggP5qGSctmew&utm_campaign=yelp_api_v3&utm_medium=api_v3_business_search&utm_source=YOPxpPg1qGggP5qGSctmew,, New York,Bakeries,8VhsQ3bXEkQlCrPyg2I1AQ,45,221,"I was really expecting the cream puffs to be mind blowing but there were quite average to me. They are definitly really cute which I understand why there was so much hype surrounding this dessert shop. However, I found my new goto place for iced vanilla lattes. I had a iced vanilla latte 2 years ago and the cafe shut down. Ever since then I have been trying to find a vanilla latte that tasted close to the one I had and I was alwyas disappointed. This cafes vanilla latte is amazing and I am so glad I decided to give it a try.",I really expect cream puff mind blow quite average They definitly really cute I understand much hype surround dessert shop However I find new goto place iced vanilla latte I iced vanilla latte year ago cafe shut Ever since I try find vanilla latte taste close one I I alwyas disappointed This cafe vanilla latte amazing I glad I decide give try,Bakeries,,Bakeries I really expect cream puff mind blow quite average They definitly really cute I understand much hype surround dessert shop However I find new goto place iced vanilla latte I iced vanilla latte year ago cafe shut Ever since I try find vanilla latte taste close one I I alwyas disappointed This cafe vanilla latte amazing I glad I decide give try 
Pearl Street Supper Club,5,low,https://www.yelp.com/biz/pearl-street-supper-club-brooklyn?adjust_creative=YOPxpPg1qGggP5qGSctmew&utm_campaign=yelp_api_v3&utm_medium=api_v3_business_search&utm_source=YOPxpPg1qGggP5qGSctmew,, Brooklyn,American (New),RqnPXUsRyFShLA5zhSQKFg,9,222,"Wine pairing was sensational! It went very well with all the food. Loved the caviar, skate, venison, bread and beat salad. The dessert was great too! Don't recommend using the facilities though as it is shared by the building. Inside is cozy and you watch them prepare all the food in a barebones kitchen very successfully. Sommelier was very knowledgeable",Wine pairing sensational It go well food Loved caviar skate venison bread beat salad The dessert great Do recommend use facility though share building Inside cozy watch prepare food barebones kitchen successfully Sommelier knowledgeable,American New,,American New Wine pairing sensational It go well food Loved caviar skate venison bread beat salad The dessert great Do recommend use facility though share building Inside cozy watch prepare food barebones kitchen successfully Sommelier knowledgeable 
Olly Olly Market,3,low,https://www.yelp.com/biz/olly-olly-market-new-york-2?adjust_creative=YOPxpPg1qGggP5qGSctmew&utm_campaign=yelp_api_v3&utm_medium=api_v3_business_search&utm_source=YOPxpPg1qGggP5qGSctmew,, New York,Food Court,Iecc3o2fy5vprsGZOeD1iw,17,223,"This new market location opened up recently and has some really delicious looking food spots. there is a lot of seating areas and public restrooms if needed. they have a pizza spot, a bar, a taco spot, a burrito spot, some sushi and other delicious looking food spots. It is a nice spot to come rest after work if needed.",This new market location open recently really delicious look food spot lot seat area public restroom need pizza spot bar taco spot burrito spot sushi delicious look food spot It nice spot come rest work need,Food Court,,Food Court This new market location open recently really delicious look food spot lot seat area public restroom need pizza spot bar taco spot burrito spot sushi delicious look food spot It nice spot come rest work need 
Cafe Spaghetti,5,low,https://www.yelp.com/biz/cafe-spaghetti-brooklyn?adjust_creative=YOPxpPg1qGggP5qGSctmew&utm_campaign=yelp_api_v3&utm_medium=api_v3_business_search&utm_source=YOPxpPg1qGggP5qGSctmew,"pickup, delivery", Brooklyn,Italian,2_3W7NFFN3m4U_8ffgEuyQ,70,224,Good meal and cute outdoor seating.  Enjoyed what we ordered but was a bit out of the way for us.,Good meal cute outdoor seating Enjoyed order bit way u,Italian,pickup delivery,Italian Good meal cute outdoor seating Enjoyed order bit way u pickup delivery
Verde on Smith,4,low,https://www.yelp.com/biz/verde-on-smith-brooklyn-4?adjust_creative=YOPxpPg1qGggP5qGSctmew&utm_campaign=yelp_api_v3&utm_medium=api_v3_business_search&utm_source=YOPxpPg1qGggP5qGSctmew,"pickup, delivery, restaurant_reservation", Brooklyn,Italian,J0c8ZtHPf08TMVeojPkNkQ,841,225,Best food and service yesterday I had chicken Marsala it was amazing .,Best food service yesterday I chicken Marsala amaze,Italian,pickup delivery,Italian Best food service yesterday I chicken Marsala amaze pickup delivery
Suram NYC,5,low,https://www.yelp.com/biz/suram-nyc-new-york?adjust_creative=YOPxpPg1qGggP5qGSctmew&utm_campaign=yelp_api_v3&utm_medium=api_v3_business_search&utm_source=YOPxpPg1qGggP5qGSctmew,"pickup, delivery", New York,Ramen,PkljF7EKWE5CfPD_zr3Jyg,16,226,Really not a fan of the chicken ramen here but the Chirashi bowl was good! Maybe err on the side of the sushi over the ramen. The takoyaki wasn't bad either. Currently BYOB. Nice to have another not too crazy expensive option in Hudson Yards!,Really fan chicken ramen Chirashi bowl good Maybe err side sushi ramen The takoyaki bad either Currently BYOB Nice another crazy expensive option Hudson Yards,Ramen,pickup delivery,Ramen Really fan chicken ramen Chirashi bowl good Maybe err side sushi ramen The takoyaki bad either Currently BYOB Nice another crazy expensive option Hudson Yards pickup delivery
Katsu-Hama,5,low,https://www.yelp.com/biz/katsu-hama-new-york?adjust_creative=YOPxpPg1qGggP5qGSctmew&utm_campaign=yelp_api_v3&utm_medium=api_v3_business_search&utm_source=YOPxpPg1qGggP5qGSctmew,"pickup, delivery, restaurant_reservation", New York,Japanese,-J8VuX3wGrYSOBu2G0hMsw,1562,227,"The amount of cabbage surprised me a bit, but I was able to finish most of everything. I got the whole set.. very tasty.. my first time having a miso soup like this, with things other than tofu and seaweed.. only thing though, i thought the potato salad would be a bit more.",The amount cabbage surprise bit I able finish everything I get whole set tasty first time miso soup like thing tofu seaweed thing though think potato salad would bit,Japanese,pickup delivery,Japanese The amount cabbage surprise bit I able finish everything I get whole set tasty first time miso soup like thing tofu seaweed thing though think potato salad would bit pickup delivery
Osteria La Baia,2,low,https://www.yelp.com/biz/osteria-la-baia-new-york?adjust_creative=YOPxpPg1qGggP5qGSctmew&utm_campaign=yelp_api_v3&utm_medium=api_v3_business_search&utm_source=YOPxpPg1qGggP5qGSctmew,, New York,Italian,OWNmOq-TAsHjGcYdCVclSw,74,228,"Everything was just fine. For a Midtown Manhattan restaurant it is actually disappointing. With all the great choices in Midtown, particularly for Italian food, there is little reason to go to Osteria La Baia. The service was ok, as was the food. The room is nice, but nothing special. On a Saturday evening it was half empty. Overall it was disappointing.",Everything fine For Midtown Manhattan restaurant actually disappointing With great choice Midtown particularly Italian food little reason go Osteria La Baia The service ok food The room nice nothing special On Saturday even half empty Overall disappoint,Italian,,Italian Everything fine For Midtown Manhattan restaurant actually disappointing With great choice Midtown particularly Italian food little reason go Osteria La Baia The service ok food The room nice nothing special On Saturday even half empty Overall disappoint 
Olmsted,1,mid-range,https://www.yelp.com/biz/olmsted-brooklyn?adjust_creative=YOPxpPg1qGggP5qGSctmew&utm_campaign=yelp_api_v3&utm_medium=api_v3_business_search&utm_source=YOPxpPg1qGggP5qGSctmew,"pickup, delivery", Brooklyn,American (New),Ulr_Nyp2nvt82EPH_BiftA,474,229,"My boyfriend and I came here for our anniversary dinner. We were blown away by everything we ordered. It was creative, delicious, and presented in a way that was truly special. The scallops appetizer and the s'mores dessert was a huge highlight. We also thought it was so sweet they brought us another dessert to celebrate our anniversary. We'll definitely be coming back.",My boyfriend I come anniversary dinner We blow away everything order It creative delicious present way truly special The scallop appetizer dessert huge highlight We also think sweet bring u another dessert celebrate anniversary We definitely come back,American New,pickup delivery,American New My boyfriend I come anniversary dinner We blow away everything order It creative delicious present way truly special The scallop appetizer dessert huge highlight We also think sweet bring u another dessert celebrate anniversary We definitely come back pickup delivery
